,,    ,,,,,,,,
,287,"ГЕНТАКС, ООО, 3808143580","г.Иркутск, ул. Урицкого, д. 14","38ме №005218, лиц.№АН00693 от 16.12.2009, действ.до 16.12.2014","бар г.Иркутск, ул. Академическая, д. 27",,,,,
,288,"Гурон, ООО, 3810035529","г.Иркутск, ул. Сибирских Партизан, д. 4","38ме №005222, лиц.№АН00694 от 22.12.2009, действ.до 22.12.2014","магазин г.Иркутск, ул. Сибирских Партизан, д. 4",,,,,
,289,"Милена, ООО, 3812124189","г.Иркутск, бул. Рябикова, д. 42, оф. 63","38ме №005225, лиц.№АН00695 от 24.12.2009, действ.до 24.12.2014","отдел г.Иркутск ул. Вампилова, 2/2",,,,,
,290,"Корнет, ООО, 3811131553","г.Иркутск, ул. Лопатина, д. 4, оф. 87","38ме №005226, лиц.№АН00696 от 24.12.2009, действ.до 24.12.2014","магазин г.Иркутск, ул. Трудовая, д. 128",,,,,
,291,"Лекс-Сервис, ООО, 3808132807","г.Иркутск, ул. Челнокова, д. 26а","38ме №005229, лиц.№АН00697 от 25.12.2009, действ.до 25.12.2014","кафе г.Иркутск, ул. Академическая, д. 30",,,,,
,292,"КристАлл, ООО, 0","п.Качуг ул. Сибирская, 17","38ме №002184, лиц.№7 от 24.12.2009, действ.до 20.11.2012","отдел г.Иркутск, бул. Постышева, д. 35Б",,,,,"администрация МО ""Качугский район"""
,293,"Аквамарин, ООО, 3808149600","г.Иркутск, ул. Декабрьских Событий, д. 119а оф.31","38ме №005242, лиц.№АН00698 от 30.12.2009, действ.до 30.12.2014","бар г.Иркутск, ул. Партизанская, д. 9",,,24.07.2012 Решение №504-02-3058/12 от 19.07.2012;,,
,294,"Альфа-Вино Байкал, ООО, 0","г.Ангарск, ул. 2-я Московская лит.А, стр. 33 ж/4, пом. № 1","№, лиц.№82 от 18.12.2009, действ.до 16.04.2014","магазин г.Иркутск, ул. Богдана Хмельницкого, д. 1",,,,,г. Ангарск
,295,"Альпари, ООО, 3812123594","г.Иркутск, ул. Безбокова, д. 7, оф. 77","38ме №003251, лиц.№АН00701 от 28.01.2010, действ.до 28.01.2015","кафе г.Иркутск, м/р-н Приморский, д. 24а",,,,,
,296,"Элина, ООО, 3811095922","г.Иркутск, ул. Иркутской 30-й дивизии, д. 4, оф. 57","38ме №003283, лиц.№АН00708 от 22.03.2010, действ.до 22.03.2012","магазин г.Иркутск, ул. Байкальская, д. 320/2 пом. 1003",,,23.03.2012 по истечению срока действия;,,
,297,"Медведи, ООО, 3811122326","г.Иркутск, пр-т Маршала Жукова, д. 11, оф. 274","38ме №003292, лиц.№АН00712 от 25.03.2010, действ.до 25.03.2013","бар г.Иркутск, ул. Карла Маркса, д. 11; бар г.Иркутск, ул. Карла Маркса, д. 11",,,,,
,298,"Региональная торговая сеть Курочка рядом, ООО, 0","г.Ангарск, - 95 кв-л, д. 22","№, лиц.№31 от 07.05.2010, действ.до 06.05.2015","магазин г.Иркутск, ул. Костычева, д. 10Б",,,,,администрация г. Ангарска
,299,"ЛюксАвто, ООО, 3812090349","г.Иркутск, ул. Академическая, д. 25","38ме №003339, лиц.№АН00732 от 24.05.2010, действ.до 24.05.2015","магазин г.Иркутск, ул. Академическая, д. 25",,,,,
,300,"Виктория, ООО, 0","г.Шелехов, - 6 кв-л, д. 10, оф. 19","№, лиц.№18 от 14.05.2010, действ.до 03.08.2012","бар г.Иркутск, м/р-н Первомайский, д. 2/2 (ул. Вампилова)",,,,,Иркутское районное МО
,301,"Еноты, ООО, 3812125023","г.Иркутск, ул. Академическая, д. 3","38ме №003526, лиц.№АН00739Пр от 09.12.2010, действ.до 30.06.2013","бар г.Иркутск, ул. Советская, д. 124д; бар г.Иркутск, ул. Лермонтова, д. 81/1",,,,,
,302,"ТЁМА, ООО, 3810316199","г.Иркутск, ул. Павла Красильникова, д. 217, оф. 36к.4","38ме №003393, лиц.№АН00747 от 12.08.2010, действ.до 12.08.2015","магазин г.Иркутск, ул. Розы Люксембург, д. 299",,,,,
,303,"Инициатива, ООО, 3812126933","г.Иркутск, ул. Лермонтова, д. 65","38ме №004065, лиц.№АН00749Пр2 от 13.07.2012, действ.до 17.08.2012; изменена 13.07.2012","магазин г.Иркутск, ул. Рабочего штаба на выезде из города",,,,,
,304,"Ресторанный холдинг, ООО, 3811120030","г.Иркутск, ул. Карла Либкнехта, д. 157","38ме №003403, лиц.№АН00751 от 20.08.2010, действ.до 22.08.2012","кафе г.Иркутск, ул. Карла Маркса, д. 40",,,,,
,305,"Кузя, ООО, 3812122745","г.Иркутск, ул. Старо-Кузьмихинская, д. 62А","38ме №003413, лиц.№АН00755 от 27.08.2010, действ.до 27.08.2015","бар г.Иркутск, ул. Старо-Кузьмихинская, д. 62А",,,,,
,306,"Прага, ООО, 3811138982","г.Иркутск, ул. Пискунова, д. 150/3","38МЕ №003425, лиц.№АН00759 от 16.09.2010, действ.до 16.09.2015","кафе г.Иркутск, ул. Депутатская, д. 42/2",,,,,
,307,"АлкоСтиль, ООО, 0","г.Ангарск, - 125кв-л стр. 1/13, оф. 3","№, лиц.№78 от 08.09.2010, действ.до 02.10.2014","магазин г.Иркутск, ул. Украинская, д. 10; отдел г.Иркутск, ул. Трактовая, д. 35В",,,,,Администрация Ангарского МО
,308,"ГлобалРост, ООО, 3808215570","г.Иркутск, ул. Цесовская Набережная, д. 12 оф.104","38ме №003524, лиц.№АН00766Пр2 от 09.12.2010, действ.до 08.11.2012","магазин г.Иркутск, ул. Павла Красильникова, д. 217; магазин г.Иркутск, ул. Байкальская, д. 274а; магазин г.Иркутск, ул. Лыткина, д. 42; магазин г.Иркутск, м/р-н Юбилейный, д. 14; магазин г.Иркутск, ул. Декабрьских Событий, д. 21; магазин г.Иркутск, м/р-н Юбилейный, д. 97; магазин г.Иркутск, ул. Декабрьских Событий, д. 85; магазин г.Иркутск, ул. Доржи Банзарова, д. 23в; магазин г.Иркутск, пер. 15-й Советский, д. 4; магазин г.Иркутск, бул. Рябикова, д. 1",,,,,
,309,"Империя Плюс, ООО, 3812129645","г.Иркутск, ул. Академическая, д. 27 оф.75","38ме №003516, лиц.№АН00783 от 08.12.2010, действ.до 08.12.2015","павильон г.Иркутск, ул. Академическая, д. 27; павильон г.Иркутск, ул. Академическая, д. 27",,,,,
,310,"Трейдагро, ООО, 0","г.Киренск, ул. Партизанская, д. 4","№, лиц.№53 от 07.12.2010, действ.до 20.02.2013",,,,,,Администрация Киренского муниципального района
,311,"ИркутскЭнергоСнаб, ООО, 3827020062",9км а/д Иркутск-Чита,"38ме №003497, лиц.№АН00544Пр от 26.11.2010, действ.до 26.11.2013","магазин г.Иркутск, ул. Байкальская в р-не дома № 224; магазин г.Иркутск, ул. Байкальская в р-не дома № 204; отдел в магазине г.Иркутск, бул. Рябикова, д. 36/6",,,,,
,312,"Абсент, ООО, 3812084095","г.Иркутск, м/р-н Первомайский, д. 52, оф. 19","38ме №004875, лиц.№АН00557 от 10.12.2008, действ.до 18.12.2013","отдел г.Иркутск, пр-т Маршала Жукова ост. ""Дружба"" (правая сторона); отдел г.Иркутск, пр-т Маршала Жукова у дома №46",,,,,
,313,"СИТИКОМ, ООО, 3811062388","г.Иркутск, ул. Лермонтова, д. 102","38ме №004968, лиц.№АН00600Пр от 20.02.2009, действ.до 30.12.2013","бар г.Иркутск, ул. Лермонтова, д. 102; кафе г.Иркутск, ул. Байкальская, д. 104; бар г.Иркутск, ул. Байкальская, д. 104",,,,,
,314,"ТК Континент, ООО, 3812084553","г.Иркутск, ул. Новгородская, д. 53","Д №561281, лиц.№АП03427 от 30.11.2005, действ.до 02.12.2015","магазин г.Иркутск, ул. Театральная, д. 9",,,,,
,315,"Торговый Дом Виктория, ООО, 3808100971","г.Иркутск, ул. Трактовая, д. 1","38ме №004885, лиц.№АН00564 от 15.12.2008, действ.до 15.12.2013","магазин г.Иркутск, ул. Трактовая, д. 1",,,,,
,316,"Смак плюс, ООО, 3811093192","г.Иркутск, ул. Трилиссера, д. 48, оф. 55","38ме №004944, лиц.№АН00523Пр от 14.01.2009, действ.до 02.10.2013","отдел г.Иркутск, ул. Депутатская (в р-не дома № 1); кафе г.Иркутск, ул. Пискунова, д. 150/1",,,,,
,317,"Вита, ООО, 3808125969","г.Иркутск, ул. Спартаковская, д. 8","38ме №003342, лиц.№АП03438Пр2 от 27.05.2010, действ.до 04.12.2012","магазин г.Иркутск, ул. Спартаковская, д. 8; магазин г.Иркутск, м/р-н Юбилейный, д. 63а",,,,,
,318,"Алис, ООО, 3810039361","г.Иркутск, пер. 18-й Советский, д. 1","38ме №004878, лиц.№АН00559 от 11.12.2008, действ.до 18.12.2013","магазин г.Иркутск, пер. 18-й Советский, д. 1",,,,,
,319,"Рустам, ООО, 3810038992","г.Иркутск, ул. Баумана, д. 218, оф. 61","38ме №004902, лиц.№АН00558Пр от 19.12.2008, действ.до 11.12.2013","магазин г.Иркутск, ул. Баумана у дома № 210",,,,,
,320,"фирма ДТД, ООО, 3808022410","г.Иркутск, ул. Рабочего штаба, д. 134","38ме №004866, лиц.№АН00548 от 01.12.2008, действ.до 13.12.2013","магазин г.Иркутск, ул. Рабочего штаба, д. 134; магазин г.Иркутск, ул. Рабочего штаба, д. 134/2",,,,,
,321,"У Саввы, ООО, 3811094559","г.Иркутск, ул. Донская, д. 21, оф. 35","38ме №003410, лиц.№АН00575Пр от 26.08.2010, действ.до 18.12.2013","отдел г.Иркутск, ул. Карла Либкнехта, д. 245; магазин г.Иркутск, ул. Костычева, д. 30",,,,,
,322,"Саларис, ООО, 3812084730","г.Иркутск, ул. Пискунова, д. 150/1","38ме №004943, лиц.№АН00604 от 12.01.2009, действ.до 12.01.2014","отдел г.Иркутск, ул. Пискунова, д. 150/1",,,,,
,323,"РИМ, ООО, 3811094206","г.Иркутск, ул. Депутатская, д. 79, оф. 3","38МЕ №004924, лиц.№АН00577Пр от 26.12.2008, действ.до 21.12.2013","отдел г.Иркутск, ул. Байкальская, д. 292",,,,,
,324,"Низами, ООО, 3808128261","г.Иркутск, ул. Баррикад, д. 189б","38ме №004859, лиц.№АН00549 от 01.12.2008, действ.до 20.12.2013","магазин г.Иркутск, ул. Баррикад, д. 189б; магазин г.Иркутск, ул. Напольная, д. 98",,,,,
,325,"ЛАКоЛид, ООО, 3808127331","г.Иркутск, ул. Урицкого, д. 8, оф. 402","38ме №003477, лиц.№АН00587 от 24.12.2008, действ.до 24.12.2013","бар г.Иркутск, ул. Чкалова, д. 6",,,,,
,326,"Абсолют, ООО, 3810039788","г.Иркутск, ул. Мичурина, д. 18, оф. 16","38ме №004891, лиц.№АН00570 от 17.12.2008, действ.до 30.12.2013","отдел г.Иркутск, ул. Степана Разина, д. 5",,,,,
,327,"Янико, ООО, 3811092625","г.Иркутск, ул. Советская, д. 176/181, оф. 12","38ме №005090, лиц.№АН00611Пр от 23.07.2009, действ.до 18.02.2014","павильон 19-й км Байкальского СНТ ""Орбита-1""",,,,,
,328,"Фламинго, ООО, 3808128409","г.Иркутск, ул. Сухэ-Батора, д. 7","38ме №004905, лиц.№АН00581 от 22.12.2008, действ.до 22.12.2013","бар г.Иркутск, ул. Сухэ-Батора, д. 7 (цокольный этаж); бар г.Иркутск, ул. Сухэ-Батора, д. 7 (1-й этаж); ресторан г.Иркутск, ул. Сухэ-Батора, д. 7 (3-й этаж)",,,,,
,329,"ТКФ Тринадцатый, ООО, 3812015133","г.Иркутск, ул. Чайковского, д. 21","38ме №004815, лиц.№АН00529 от 22.10.2008, действ.до 22.10.2013","магазин г.Иркутск, ул. Чайковского, д. 21",,,,,
,330,"Радуга, ООО, 3810039097","г.Иркутск, ул. Крымская, д. 12","38ме №004989, лиц.№АН00620 от 23.03.2009, действ.до 23.03.2014","магазин г.Иркутск, ул. Крымская, д. 12",,,,,
,331,"Жемчужина, ООО, 3812084105","г.Иркутск, ул. Лермонтова, д. 309п","38ме №004894, лиц.№АН00572 от 18.12.2008, действ.до 29.12.2013","отдел г.Иркутск, ул. Лермонтова, д. 309п",,,,,
,332,"Катарсис, ООО, 3808128423","г.Иркутск, ул. Литвинова, д. 16","38ме №004893, лиц.№АН00571 от 17.12.2008, действ.до 22.12.2013","бар г.Иркутск, ул. Литвинова, д. 16",,,,,
,333,"Арда, ООО, 3808129836","г.Иркутск, ул. Дальневосточная, д. 138, оф. 25","38ме №004988, лиц.№АН00619 от 20.03.2009, действ.до 22.03.2014","отдел г.Иркутск, ул. Чехова, д. 22/а; отдел г.Иркутск, ул. Зимняя, д. 1",,,04.04.2012 Решение №504-02-1350/12 от 04.04.2012;,,
,334,"Успех, ООО, 3812085596","г.Иркутск, ул. Челнокова, д. 24","38ме №005215, лиц.№АН00586Пр от 15.12.2009, действ.до 25.12.2013","магазин г.Иркутск, ул. Челнокова, д. 24; закусочная г.Иркутск, ул. Челнокова, д. 24; отдел г.Иркутск, ул. Академическая, д. 12а",,,,,
,335,"Зинира, ООО, 3811094654","г.Иркутск, ул. Депутатская, д. 81","38ме №004890, лиц.№АН00569 от 17.12.2008, действ.до 29.12.2013","магазин г.Иркутск, ул. Депутатская, д. 81",,,,,
,336,"Звезда, ООО, 3811061225","г.Иркутск, ул. Ширямова, д. 13","38ме №004606, лиц.№АП03465Пр2 от 29.01.2008, действ.до 29.12.2013","кафе г.Иркутск, ул. Трактовая, д. 18; кафе г.Иркутск, ул. Ширямова, д. 13 (в ночном клубе); кафе г.Иркутск, ул. Ширямова, д. 13",,,,,
,337,"Велл, ООО, 3809011629","г.Иркутск, ул. Степана Разина, д. 11д","№, лиц.№111 от 01.12.2010, действ.до 07.02.2012","магазин г.Иркутск, ул. Степана Разина, д. 11д; магазин г.Ангарск квртал 60, дом 5/6, пом. 20",,,08.02.2012 по истечению срока действия;,,Администрация Ангарского МО
,338,"Алара, ООО, 3812084715","г.Иркутск, ул. Профсоюзная, д. 4, оф. 26","38ме №003542, лиц.№АП03467Пр от 25.08.2006, действ.до 29.12.2015","магазин г.Иркутск, пр-т Маршала Жукова, д. 72, оф. п.1а; магазин г.Иркутск, ул. Жигулевская, д. 7; магазин г.Иркутск, ул. Баррикад, д. 189в",,,,,
,339,"Вечернее, ООО, 3810039080","г.Иркутск, ул. Розы Люксембург, д. 1а","38ме №004910, лиц.№АН00584 от 23.12.2008, действ.до 23.12.2013","кафе г.Иркутск, ул. Розы Люксембург, д. 1а; кафе г.Иркутск, ул. Розы Люксембург, д. 1а",,,,,
,340,"Константа-Фуд, ООО, 3808124933","г.Иркутск, ул. Литвинова, д. 17","38ме №003575, лиц.№АН00799 от 29.12.2010, действ.до 29.12.2012","кафе г.Иркутск, бул. Гагарина б/р, д. 9",,,,,
,341,"АША, ООО, 3812084673","г.Иркутск, бул. Рябикова, д. 13а, оф. 80","38ме №005086, лиц.№АН00602Пр от 21.07.2009, действ.до 30.12.2013","магазин г.Иркутск, бул. Рябикова, д. 62 (ост. ""Винзавод""); магазин г.Иркутск, ул. Березовая Роща, д. 64б (рынок ""Мельниковский"")",,,,,
,342,"Астарта, ООО, 3827019532","п.Молодежный ул. Ангарская, 5","№, лиц.№АН00609 от 11.02.2009, действ.до 11.02.2014","магазин г.Иркутск, ул. Байкальская ост. ""ГМЗ"", со строны жилых домов",,,,,
,343,"ВДА, ООО, 3812066321","г.Иркутск, ул. Лермонтова, д. 77, оф. 8","38ме №003470, лиц.№АН00538 от 13.11.2008, действ.до 13.11.2013","кафе г.Иркутск, ул. Улан-Баторская, д. 9",,,,,
,344,"Торговая Марка Кайрос, ООО, 3819011427","г.Иркутск, ул. Трактовая, д. 1 павильон 1","38ме №004094, лиц.№АП03200Пр20 от 31.07.2012, действ.до 28.03.2015; изменена 31.07.2012","отдел г.Иркутск, бул. Рябикова, д. 32Г; отдел г.Иркутск, бул. Рябикова, д. 32г; отдел г.Иркутск, бул. Рябикова, д. 32г; магазин г.Иркутск, ул. Трактовая, д. 1; отдел г.Ангарск, - 125кв-л строение 1/13; отдел г.Иркутск, м/р-н Университетский м/р, д. 43; павильон г.Ангарск, - 125кв-л строение1/13, зал 2; магазин г.Усолье-Сибирское, пр-т Ленинский, д. 3а (территория ПТК ""Водопад""); магазин г.Ангарск, м/р-н 33, д. 7, оф. 1; магазин г.Иркутск, ул. Академическая, д. 5а;",,,,,Отдел лицензирования
,0,,,,"отдел г.Усолье-Сибирское, пр-т Ленинский, д. 10; магазин г.Усолье-Сибирское, ул. Стопани, д. 20 (торг.м. 116, 117); бар г.Усолье-Сибирское, ул. Луначарского, д. 1Б; магазин г.Ангарск, - 125кв-л стр.1/1, пом. 2,4,5,10; отдел г.Усолье-Сибирское, ул. Стопани, д. 20 отдел 156 в ТЦ ""Оптовый""; отдел с.Смоленщина, ул. Трактовая, д. 23б; магазин г.Ангарск, 254 квартал, д.3 блок Б, помещение 17; магазин г.Ангарск, м/н 12, 32",,,,,
,345,"Баргузит, ООО, 3808215228","г.Иркутск, ул. Урицкого, д. 16","38ме №003662, лиц.№АН00777Пр5 от 15.06.2011, действ.до 26.11.2011; изменена 13.01.2011; изменена 15.02.2011; изменена 15.04.2011; изменена 15.06.2011","магазин г.Иркутск, ул. Октябрьской Революции, д. 1; магазин г.Иркутск, ул. Ивана Кочубея, д. 17; магазин г.Иркутск, ул. Ленская, д. 1Б; магазин г.Иркутск, ул. Ленинградская, д. 102; магазин г.Иркутск, ул. Мира, д. 1; магазин г.Иркутск, м/р-н Приморский, д. 22; магазин г.Иркутск, ул. Киевская, д. 24; бар г.Иркутск, ул. Урицкого, д. 16; бар г.Иркутск, ул. Урицкого, д. 16; магазин г.Иркутск, ул. Октябрьской Революции, д. 1; ресторан г.Иркутск, ул. Октябрьской Революции, д. 1;",,,27.11.2011 по истечению срока действия;,,
,0,,,,"закусочная г.Иркутск, ул. Октябрьской Революции, д. 1; магазин г.Иркутск, ул. Байкальская, д. 198а; магазин г.Иркутск, ул. Байкальская, д. 207; магазин г.Иркутск, ул. Омулевского, д. 5; магазин г.Иркутск, м/р-н Первомайский, д. 25; магазин г.Иркутск, ул. 5-й Армии, д. 5; магазин г.Ангарск, ул. Фестивальная, д. 6; магазин г.Ангарск, м/р-н 15, д. 31; магазин г.Ангарск, м/р-н 22, д. 12 пом. 61; павильон г.Ангарск, ул. Ленина Торговый центр ОАО ""АУС"", торговый зал №2 (пав.№63); магазин г.Иркутск, ул. Маяковского, д. 19;",,,,,
,346,"Фелис, ООО, 0","г.Ангарск, м/р-н 7, д. 1, оф. 25","A №167457, лиц.№123 от 16.12.2010, действ.до 16.12.2011; изменена 13.01.2011","магазин г.Иркутск, бул. Постышева, д. 35б",,,17.12.2011 по истечению срока действия;,,Администрация Ангарского МО
,347,"Поливест, ООО, 0","г.Усолье-Сибирское, ул. Лесная, д. 10, оф. 54","№, лиц.№15 от 21.10.2009, действ.до 29.12.2011; изменена 13.01.2011","магазин г.Иркутск, ул. Партизанская, д. 73",,,30.12.2011 по истечению срока действия;,,Администрация Усольского районного МО
,348,"Ветер, ООО, 0","г.Иркутск, ул. Ракитная, д. 14, оф. 1","№, лиц.№68 от 19.08.2011, действ.до 13.10.2014; изменена 17.01.2011; изменена 31.08.2011; изменена 01.12.2011","отдел г.Иркутск, ул. Олонская; отдел г.Иркутск, ул. Партизанская, д. 71а; отдел г.Иркутск, ул. Депутатская, д. 49а; отдел г.Иркутск, ул. Авиастроителей, д. 2А; отдел г.Иркутск, пер. Лесной в районе ост. ""Лыжная база""",,,,,Администрация Шелеховского района
,349,"Айсберг, ООО, 3827035654","п.Ново-Иркутский, ул. Саянская, д. 11а","38ме №004016, лиц.№АН00784Пр8 от 05.06.2012, действ.до 09.12.2015; изменена 05.06.2012","отдел г.Иркутск, ул. Набережная Иркута, д. 1; отдел с.Юголок, ул. Мира, д. 6; отдел с.Новая Уда, ул. Ленина, д. 15а; отдел с.Знаменка, ул. Молодежная, д. 61а; отдел с.Нижняя Слобода, ул. Центральная, д. 30а; отдел п.Жигалово, ул. Каландаришвили, д. 52; отдел п.Жигалово, ул. Левина, д. 23; отдел п.Жигалово, ул. Чупановская, д. 71; отдел п.Жигалово, ул. Советская, д. 21; отдел п.Жигалово, ул. Геологическая, д. 3б; отдел п.Качуг, ул. Фрунзе, д. 1; отдел д.Косогол, ул. Центральная, д. 16;",,,,,
