,,    ,,,,,,,,
,770,"Погребок, ООО, 3812088533","г.Иркутск, бул. Рябикова, д. 31б","Д №561842, лиц.№АН00234 от 03.10.2006, действ.до 03.10.2011","магазин г.Иркутск, м/р-н Университетский м/р, д. 70",,,04.10.2011 по истечению срока действия;,,
,771,"Виола, ООО, 3810043054","г.Иркутск ст. Горка, 39/10, 6","38ме №004445, лиц.№АН00272Пр от 15.08.2007, действ.до 04.12.2011","кафе г.Иркутск, ул. Розы Люксембург, д. 182",,,03.10.2011 Решение № от 03.10.2011;,,
,772,"Артемида, ООО, 3812098002","г.Иркутск, ул. Академическая, д. 30","38ме №003435, лиц.№АН00761 от 01.10.2010, действ.до 03.10.2011","магазин г.Иркутск, ул. Академическая, д. 30; бар г.Иркутск, ул. Академическая, д. 30; закусочная г.Иркутск, ул. Ярославского, д. 302",,,04.10.2011 по истечению срока действия;,,
,773,"Глориоза, ООО, 3810042389","г.Иркутск, ул. Ангарская, д. 11б","38ме №003801, лиц.№А017 от 03.10.2011, действ.до 03.10.2016","магазин г.Иркутск, ул. Ангарская, д. 11б",,,,,
,774,"Гарант-Алко, ООО, 3808143319","г.Иркутск, ул. Кожзаводская, д. 6","Д №561845, лиц.№АН00236 от 04.10.2006, действ.до 04.10.2011","отдел г.Иркутск, ул. Кожзаводская, д. 6",,,05.10.2011 по истечению срока действия;,,
,775,"Виола, ООО, 3810043054","г.Иркутск ст. Горка, 39/10, 6","38ме №003861, лиц.№А018Пр от 22.12.2011, действ.до 04.10.2012; изменена 15.12.2011","магазин г.Иркутск, ул. Розы Люксембург, д. 219б",,,,,
,776,"Иркутскнефтепродукт, ЗАО, 3800000742","г.Иркутск, ул. Октябрьской Революции, д. 5","38ме №003568, лиц.№АН00432Пр9 от 27.12.2010, действ.до 10.01.2013","магазин г.Иркутск, ул. Сергеева, д. 2; магазин г.Иркутск, ул. Ширямова, д. 17; магазин г.Иркутск, ул. Трактовая, д. 35а; магазин г.Иркутск, ул. Рабочего штаба, д. 135; магазин г.Иркутск, ул. Розы Люксембург, д. 172А; магазин г.Иркутск, ул. Сурнова, д. 31; магазин г.Тайшет, ул. Кирова, д. 153а-н; магазин г.Нижнеудинск, ул. Кашика, д. 245а; магазин г.Усолье-Сибирское, ул. Ремонтная, д. 23; магазин г. Тулун, ул. Володарского, д. 116б; магазин г.Усть-Илимск, ул. Энгельса, д. 14;",,,06.10.2011 Решение №504-02-5506/11 от 06.10.2011;,,
,0,,,,"магазин г.Байкальск 146км+375м автодороги ""Иркутск-Чита""; магазин п.Култук 101км+100м автодороги ""Иркутск-Чита""; магазин г.Шелехов, ул. Култукский тракт, д. 9; магазин г.Ангарск 4 км а/д ""Байкал"" на участке ""Подъезд к Ангарску"", стр. 5; магазин г.Ангарск, м/р-н 34 55 метров от домов №№ 7 и 8 м/р 33; магазин Куйтунский р-н 1559,3 км а/д ""Красноярск-Иркутск""; магазин г. Братск П23110100; магазин г. Братск, пр-д Индустриальный, д. 15; магазин г. Братск П20690100;",,,,,
,0,,,,"магазин г. Братск, ул. Коммунальная, д. 11а; магазин г. Братск П17010100; магазин г. Братск Р01030200; магазин г. Вихоревка кольцо а/д ""Братск-Вихоревка-Турма-Чуна""; магазин г.Усть-Кут, ул. Пушкина, д. 78; отдел с. Ухтуй 1623км а/д Новосибирск-Иркутск; магазин г. Тулун, ул. Гидролизная, д. 95; магазин г.Усть-Илимск, ул. Партизанская, д. 3; магазин г. Алзамай, пер. Сосновый, д. 10; магазин р.п. Залари 1677 км автодороги Красноярск-Иркутск;",,,,,
,0,,,,"магазин г. Братск в районе кольца автодороги Братск-Тулун-Порожский; магазин г.Иркутск, ул. Байкальская, д. 252Б; магазин п. Магистральный, ул. Российская, д. 16; магазин г.Иркутск, ул. Маяковского, д. 65а; магазин п.Жигалово, ул. Еловая, д. 2; магазин г.Зима пересечение ул. 5-й Армии и ул. Ломоносова; магазин п. Бохан, ул. Гагарина, д. 53; магазин г.Ангарск, - 124 кв-л, д. стр.7",,,,,
,777,"АС-ОЙЛ, ООО, 3808085360","г.Иркутск, ул. Култукская, д. 4","38ме №005122, лиц.№АН00486Пр от 10.09.2009, действ.до 22.06.2013","магазин г.Иркутск, ул. Шевцова, д. 152; магазин г.Иркутск, ул. 2-я Красноказачья, д. 4",,,06.10.2011 Решение №504-02-5507 от 06.10.2011;,,
,778,"Продлайнер, ООО, 3810050478","г.Иркутск, ул. Розы Люксембург, д. 293, оф. 350","38ме №003448, лиц.№АН00762Пр от 25.10.2010, действ.до 06.10.2011","павильон г.Иркутск, ул. Розы Люксембург, д. 293а пав.№53",,,07.10.2011 по истечению срока действия;,,
,779,"Рыжкова, ООО, 3808126472","г.Иркутск, ул. Фридриха Энгельса, д. 12, оф. 26","38ме №003846, лиц.№АН00595Пр2 от 25.11.2011, действ.до 29.12.2013; изменена 06.10.2011; изменена 25.11.2011","отдел с. Пивовариха, ул. Садовая, д. 2; магазин г.Иркутск, ул. Байкальская, д. 13; магазин г. Иркутск, ул. Трилиссера, 55",,,,,
,780,"Гарант-Алко, ООО, 3808143319","г.Иркутск, ул. Кожзаводская, д. 6","38ме №003809, лиц.№А019 от 07.10.2011, действ.до 06.10.2016","отдел г.Иркутск, ул. Кожзаводская, д. 6",,,,,
,781,"СиУай Иркутск Отель Лизинг, ООО, 3810317058","г.Иркутск, ул. Сурикова, д. 2, оф. 4","38ме №003812, лиц.№А020 от 12.10.2011, действ.до 12.10.2015","ресторан г.Иркутск, ул. Чкалова, д. 15; бар г.Иркутск, ул. Чкалова, д. 15; магазин г.Иркутск, ул. Чкалова, д. 15; магазин г.Иркутск, ул. Чкалова, д. 15",,,,,
,782,"Ли Сяоцзянь, ООО, 3808134716","г.Иркутск, ул. Литвинова, д. 1","38 МЕ №003813, лиц.№А021 от 13.10.2011, действ.до 13.10.2012","кафе г.Иркутск, ул. Литвинова, д. 1",,,,,
,783,"САН-Вояж, ООО, 3808076091","г.Иркутск, ул. Софьи Перовской, д. 11","А №244679, лиц.№0089 от 16.10.2006, действ.до 15.10.2011","кафе г.Иркутск, ул. Тимирязева, д. 16г; кафе п.Листвянка, ул. Чапаева, д. 91",,,16.10.2011 по истечению срока действия;,,Иркутский район
,784,"Анвер, ООО, 3808139880","г.Иркутск, ул. Красных Мадьяр, д. 57","Д №561852, лиц.№АН00239Пр от 20.05.2008, действ.до 17.10.2011","отдел г.Иркутск, ул. Красных Мадьяр у дома № 57",,,18.10.2011 по истечению срока действия;,,
,785,"Лидон, ООО, 3808140276","г.Иркутск, ул. Фурье, д. 16","Д №561853, лиц.№АН00240 от 17.10.2006, действ.до 17.10.2011","кафе г.Иркутск, ул. Фурье, д. 16",,,18.10.2011 по истечению срока действия;,,
,786,"Расцвет, ООО, 3812089921","г.Иркутск, ул. Профсоюзная, д. 64 б/с 8","Д №561854, лиц.№АН00241 от 26.10.2011, действ.до 17.10.2011","магазин г.Иркутск, ул. Профсоюзная, д. 64 б/с 8",,,18.10.2011 по истечению срока действия;,,
,787,"Анвер, ООО, 3808139880","г.Иркутск, ул. Красных Мадьяр, д. 57","38ме №003814, лиц.№А022 от 17.10.2011, действ.до 17.10.2012","магазин г.Иркутск, ул. Красных Мадьяр у дома №57",,,,,
,788,"Элис, ООО, 3811095111","г.Иркутск, ул. Седова, д. 29","38ме №003815, лиц.№А023 от 18.10.2011, действ.до 18.10.2013","бар г.Иркутск, ул. Седова, д. 29 (ИГМТ); бар г.Иркутск, ул. Седова, д. 29 (ИГМТ); бар г.Иркутск, ул. Седова, д. 29 (в помещении автомойки); бар г.Иркутск, ул. Седова, д. 29 (в помещении автомойки); бар г.Иркутск, ул. Седова, д. 29 (ИГМТ)",,,,,
,789,"Веритас плюс, ООО, 3811120583","г.Иркутск, ул. Красноказачья, д. 119, оф. И24","38ме №003885, лиц.№А024Пр2 от 29.12.2011, действ.до 18.10.2012; изменена 06.12.2011; изменена 29.12.2011","отдел г.Иркутск, ул. Свердлова, д. 15; магазин г.Иркутск, пер. Пионерский, д. 10; отдел г.Иркутск, ул.Байкальская,11; магазин г.Иркутск, ул.Рабочая, Нижний мост р.Ушаковка (ТЦ ""Ушаковский""); отдел г.Иркутск, ул. Красноказачья, д. 119",,,,,
,790,"Торговый Дом ОлАнд, ООО, 3810314650","г.Иркутск, ул. Олега Кошевого, д. 65 оф. 2","38ме №003982, лиц.№А025Пр3 от 04.05.2012, действ.до 19.10.2016; изменена 27.01.2012; изменена 10.02.2012; изменена 04.05.2012","отдел г.Иркутск ул. Вампилова, 2/2 (магазин ""Универсам""); отдел г.Иркутск, бул. Рябикова, д. 32Г ТЦ""Ручей""; отдел г.Иркутск, бул. Рябикова, д. 32Г ТЦ""Ручей""; магазин г.Иркутск, ул. Олега Кошевого, д. 65-2; магазин г.Иркутск, ул. Свердлова, д. 36 ТЦ ""Сезон""; отдел г. Шелехов, квартал 6, 29, ТЦ ""Былина""; закусочная г.Иркутск, ул.Чехова, 22; магазин г.Иркутск, ул. Калинина, 7, 1А, 2",,,,,Отдел лицензирования
,791,"Юник, ООО, 3812086208","г.Иркутск, бул. Рябикова, д. 29, оф. 51","38ме №003934, лиц.№А026Пр от 27.02.2012, действ.до 23.10.2014; изменена 27.02.2012","магазин г.Иркутск, м/р-н Первомайский, д. 9б (ост. ""Башня""); магазин""""Вулкан"""" г.Иркутск, ул.Красногвардейская,24; магазин""""Стелла"""" г.Иркутск, ул.Красноярская,39",,,,,
,792,"Агил, ООО, 3808131144","г.Иркутск, бул. Рябикова у домов 55, 59","38ме №005152, лиц.№АН00402Пр2 от 25.10.2011, действ.до 19.11.2012; изменена 25.10.2011","павильон г.Иркутск, бул. Рябикова у домов 55, 59; отдел г.Иркутск, ул. Северная, д. 48",,,,,
,793,"Расцвет, ООО, 3812089921","г.Иркутск, ул. Профсоюзная, д. 64 б/с 8","38МЕ №003824, лиц.№А027 от 26.10.2011, действ.до 26.10.2016","магазин г.Иркутск, ул. Профсоюзная, д. 64",,,,,
,794,"Центр Вселенной, ООО, 3808206706","г.Иркутск, ул. Фридриха Энгельса,д. 8 оф.3","38ме №003453, лиц.№АН00765 от 28.10.2010, действ.до 28.10.2011","бар г.Иркутск, ул. Фридриха Энгельса, д. 8; бар г.Иркутск, ул. Фридриха Энгельса, д. 8",,,29.10.2011 по истечению срока действия;,,
,795,"РОВЕР, ООО, 3811076461","г.Иркутск, ул. Байкальская, д. 244А","38МЕ №003826, лиц.№А029 от 28.10.2011, действ.до 27.10.2012","кафе г.Иркутск, ул. Сергеева, д. 3",,,,,
,796,"Марина, ООО, 3811104084","г.Иркутск, ул. Байкальская, д. 257, оф. 8","38ме №004461, лиц.№АН00248Пр от 14.09.2007, действ.до 30.10.2011","магазин г.Иркутск, ул. Карла Либкнехта у дома №41",,,31.10.2011 по истечению срока действия;,,
,797,"БВЭК, ООО, 3812087402","г.Иркутск, бул. Рябикова, д. 37, оф. 45","Д №561869, лиц.№АН00249 от 31.10.2006, действ.до 31.10.2011","магазин г.Иркутск, ул. Маршала Конева между домами №66, №64 и №20",,,01.11.2011 по истечению срока действия;,,
,798,"Гранд Виктори, ООО, 3812090405","г.Иркутск, ул. Маршала Конева, д. 34","Д №561870, лиц.№АН00250 от 31.10.2006, действ.до 31.10.2011","кафе г.Иркутск, ул. Маршала Конева, д. 34",,,01.11.2011 по истечению срока действия;,,
,799,"БОЯР, ООО, 3808174772","г.Иркутск, ул. Партизанская, д. 112/2","38ме №004667, лиц.№АН00468Пр2 от 31.10.2011, действ.до 25.04.2013; изменена 31.10.2011","магазин г.Иркутск, ул. Партизанская, д. 112/2; магазин г.Иркутск, ул. Лермонтова, д. 281/1",,,,,
,800,"Лидон, ООО, 3808140276","г.Иркутск, ул. Фурье, д. 16","38МЕ №003827, лиц.№А030 от 31.10.2011, действ.до 31.10.2012","кафе г.Иркутск, ул. Фурье, д. 16",,,,,
,801,"Марина, ООО, 3811104084","г.Иркутск, ул. Байкальская, д. 257, оф. 8","38 МЕ №003810, лиц.№А028 от 31.10.2011, действ.до 30.10.2012","магазин г.Иркутск, ул. Карла Либкнехта у дома №41",,,,,
,802,"Ресторан ВАРВАР, ООО, 3811141671","г.Иркутск, ул. Красного Восстания, д. 20 оф.100","38ме №003459, лиц.№АН00768 от 02.11.2010, действ.до 02.11.2011","бар г.Иркутск, ул. Красного Восстания, д. 20 оф. 100; ресторан г.Иркутск, ул. Красного Восстания, д. 20 оф. 100",,,03.11.2011 по истечению срока действия;,,
,803,"Злата, ООО, 3808141350","г.Иркутск, ул. Декабрьских Событий, д. 103А","38МЕ №003832, лиц.№А032 от 02.11.2011, действ.до 02.11.2012","магазин г.Иркутск, ул. Декабрьских Событий, д. 103а",,,,,
,804,"Пятое колесо, ООО, 3811145676","г.Иркутск, ул. Ширямова, д. 32/1","38МЕ №003831, лиц.№А031 от 02.11.2011, действ.до 02.11.2012","бар г.Иркутск, ул. Ширямова, д. 32/1 2 эта",,,,,
,805,"Ресторан Русь, ООО, 3811092664","г.Иркутск, ул. Трудовая, д. 132, оф. 12","Д №561247, лиц.№АП03394 от 03.11.2005, действ.до 03.11.2011","бар г.Иркутск, ул. Свердлова, д. 19; ресторан г.Иркутск, ул. Свердлова, д. 19",,,04.11.2011 по истечению срока действия; 04.11.2011по истечению срока продления;,,
,806,"Ангара, ООО, 3811096500","г.Иркутск, ул. Красных Мадьяр, д. 66, оф. 21","Д №561875, лиц.№АН00252 от 07.11.2006, действ.до 07.11.2011","кафе г.Иркутск, пр-т Маршала Жукова, д. 48",,,08.11.2011 по истечению срока действия;,,
,807,"Энки, ООО, 3811102030","г.Иркутск, ул. Ширямова, д. 15а","38ме №004353, лиц.№АН00253Пр от 08.05.2007, действ.до 07.11.2011","бар г.Иркутск, ул. Ширямова, д. 15а",,,08.11.2011 по истечению срока действия;,,
,808,"Статус-Н, ООО, 3811138703","г.Иркутск, ул. Волжская, д. 51, оф. 14","38МЕ №003833, лиц.№А033 от 08.11.2011, действ.до 08.11.2016","магазин г.Иркутск, ул. Зимняя, д. 1 № 1-20; магазин г.Иркутск, ул. Зимняя, д. 1 № 5 ( зал 7); магазин г.Иркутск, ул. Зимняя, д. 1 № 13 ( зал 7)",,,,,
,809,"МК и Компания, ООО, 3808135702","г.Иркутск, ул. Степана Разина, д. 12а","Д №561900, лиц.№АН00254Пр от 01.12.2006, действ.до 09.11.2011","магазин г.Иркутск, ул. Степана Разина, д. 9; магазин г.Иркутск, ул. Степана Разина, д. 12а; магазин г.Иркутск, ул. Трудовая, д. 66",,,10.11.2011 по истечению срока действия;,,
,810,"Континент, ООО, 3811101478","г.Иркутск, ул. Коммунистическая, д. 22","38ме №003466, лиц.№АН00769 от 11.11.2010, действ.до 11.11.2011","магазин г.Иркутск, ул. Коммунистическая, д. 22",,,12.11.2011 по истечению срока действия;,,
,811,"Альби, ООО, 3808105850","г.Иркутск, ул. Ленина, д. 18","Д №561881, лиц.№АН00256 от 13.11.2006, действ.до 13.11.2011","магазин г.Иркутск, ул. Баумана, д. 195",,,14.11.2011 по истечению срока действия;,,
,812,"ААИ, ООО, 3808209552","г.Иркутск, ул. 5-й Армии, д. 40, оф. 28","38ме №003475, лиц.№АН00770 от 15.11.2010, действ.до 15.11.2011","магазин г.Иркутск, ул. Красноярская, д. 39",,,16.11.2011 по истечению срока действия;,,
,813,"Нарцисс, ООО, 3811092262","г.Иркутск, ул. Депутатская, д. 11","38ме №003443, лиц.№АП03407Пр2 от 15.10.2010, действ.до 17.11.2011","магазин г.Иркутск, ул. Депутатская у дома № 11",,,18.11.2011 по истечению срока действия; 18.11.2011по истечению срока продления;,,
,814,"Камея, ООО, 3808127701","г.Иркутск, пер. Зеленый м/р, д. 3, оф. 51","Д №561261, лиц.№АП03408 от 17.11.2005, действ.до 17.11.2011","магазин г.Иркутск, пер. Зеленый м/р, д. 1/2; магазин г.Иркутск, пер. Зеленый м/р, д. 1/3",,,18.11.2011 по истечению срока действия; 18.11.2011по истечению срока продления;,,
,815,"Ресторан Арлекино, ООО, 3811137019","г.Иркутск, ул. Байкальская, д. 295/2, оф. 31","38ме №003482, лиц.№АН00772 от 18.11.2010, действ.до 18.11.2011","ресторан г.Иркутск, ул. Красногвардейская, д. 20/2",,,19.11.2011 по истечению срока действия;,,
,816,"Гарцующий Пони, ООО, 3811116629","г.Иркутск, ул. Свердлова, д. 23а","38ме №003483, лиц.№АН00773 от 18.11.2010, действ.до 18.11.2011","кафе г.Иркутск, ул. Свердлова, д. 23а",,,19.11.2011 по истечению срока действия;,,
,817,"Партия, ООО, 3808173602","г.Иркутск, ул. Степана Разина, д. 27","38МЕ №003836, лиц.№А035 от 17.11.2011, действ.до 17.11.2012","кафе г.Иркутск, ул. Байкальская, д. 108",,,,,
,818,"Нарцисс, ООО, 3811092262","г.Иркутск, ул. Депутатская, д. 11","38МЕ №003835, лиц.№А034 от 17.11.2011, действ.до 17.11.2012","магазин г.Иркутск, ул. Депутатская у дома № 11",,,,,
,819,"Гранд, ООО, 3811094527","г.Иркутск, ул. Урожайная, д. 11","38ме №005210, лиц.№АН00257Пр от 10.12.2009, действ.до 19.11.2011","отдел г.Иркутск, ул. Урожайная у дома № 10",,,20.11.2011 по истечению срока действия;,,
,820,"Стелла, ООО, 3812088043","г.Иркутск, ул. Терешковой, д. 42, оф. 7","Д №561885, лиц.№АН00258 от 20.11.2006, действ.до 20.11.2011","магазин г.Иркутск, м/р-н Юбилейный у дома №25",,,21.11.2011 по истечению срока действия;,,
,821,"ТОРГОВЫЙ ДОМ АДА, ООО, 3808046280","г.Иркутск, ул. Коммунаров, д. 12","38ме №003838, лиц.№АН00532Пр2 от 21.11.2011, действ.до 27.10.2013; изменена 21.11.2011","бар г.Иркутск, ул. Литвинова, д. 2; кафе г.Иркутск, ул. Лапина, д. 1; бар ул. Карла Маркса, 18",,,,,
,822,"ТАБО, ООО, 3808128720","г.Иркутск, ул. Советская, д. 111, оф. 8","Д №561887, лиц.№АН00259 от 22.11.2006, действ.до 22.11.2011","бар г.Иркутск, ул. Красноказачья, д. 119",,,23.11.2011 по истечению срока действия;,,
,823,"Бизнес Леди, ООО, 3812129204","г.Иркутск, ул. Академическая, д. 56/4","38ме №003485, лиц.№АН00774 от 22.11.2010, действ.до 22.11.2011","кафе""""Хаббл-Баббл"""" г.Иркутск, ул. Академическая, д. 56/4",,,23.11.2011 по истечению срока действия;,,
,824,"Алтай Монгол Барбекю Ресторан, ООО, 3849005854","г.Иркутск, ул. Свердлова, д. 36 оф.433","38ме №003486, лиц.№АН00775 от 22.11.2010, действ.до 22.11.2011","кафе г.Иркутск, ул. Свердлова, д. 36",,,23.11.2011 по истечению срока действия;,,
,825,"Центр Вселенной, ООО, 3808206706","г.Иркутск, ул. Фридриха Энгельса,д. 8 оф.3","38МЕ №003837, лиц.№А036 от 21.11.2011, действ.до 21.11.2012","бар г.Иркутск, ул. Фридриха Энгельса, д. 8; бар г.Иркутск, ул. Фридриха Энгельса, д. 8",,,,,
,826,"Ладья, ООО, 3827011220","п.Большая Речка Большереченское лесничество, кв.236, 49 км Байкальского тракта","Д №561888, лиц.№АН00260 от 23.11.2006, действ.до 23.11.2011","ресторан г.Иркутск, м/р-н Университетский м/р, д. 43",,,24.11.2011 по истечению срока действия;,,
,827,"ООО ""Фрея"", 3810319922","г. Иркутск, Боково, ул. Трактовая, 1а","38ме №003840, лиц.№А037 от 23.11.2011, действ.до 23.11.2012","кафе г. Иркутск, ул. Вампилова, 50",,,,,
,828,"ТД Сибирская Компания, ООО, 3808171725","г.Иркутск, ул. Октябрьской Революции, д. 1","38ме №005114, лиц.№АН00663 от 21.08.2009, действ.до 23.08.2014","отдел г.Иркутск, ул. Трактовая, д. 1 (пав. 30*С)",,,25.11.2011 Решение №504-02-6516/11 от 25.11.2011;,,
,829,"Розничный Стандарт, ООО, 3810317562","г.Иркутск, ул. Полярная, д. 42","38ме №003842, лиц.№А038 от 25.11.2011, действ.до 25.11.2014","магазин г.Иркутск, ул. Розы Люксембург, д. 215Б; магазин г.Иркутск, бул. Рябикова, д. 1ж; магазин г.Иркутск, ул. Тельмана, д. 7; магазин г.Иркутск, м/р-н Юбилейный, д. 16",,,,,
