Табл. А.3. Перечень запросов**,,,,,,,,,
,,,,,,,,,
№,Наименование запрашиваемого документа (совокупности сведений),Наименование запроса,Внешние зависимости при выполнения запроса,"Ведомство, ответственное за направление запроса","Должности лиц, ответственных за направление запроса","Ведомство, ответственное за направление ответа на запрос","Должности лиц, ответственных за направление ответа на запрос***",Описание запроса подготовлено на основании данных Реестр МВ*,
,"Укажите наименование документа (совокупности сведений), подлежащего получению по каналам МВ.","Укажите наименование запроса о получении данного документа по каналам МВ. 
Наименование запроса будет использоваться, вместо полного перечисления атрибутов запроса (наименование подуслуги, документа, подуслуги, ответственных органов и т.д.). Поэтому желательно выбрать такое наименование, которое позволит отличить данный запрос от иных запросов в рамках анализируемой услуги.","Поле заполняется, если данный запрос не может быть направлен до получения ответа на какой-либо иной запрос, направляемый в рамках данной подуслуги.
Укажите номер(а) и наименование(я) запроса(ов), от которого(ых) зависит возможность направления данного запроса.","Укажите наименование ведомства, ответственного за направление запроса.","Укажите должности лиц, ответственных за направление запроса.","Укажите наименование ведомства, ответственного за подготовку ответа на запрос.","Укажите должности лиц, ответственных за направление ответа на запрос.","Введите код:
1 - если данный запрос внесён в Реестр МВ, и заполнение форм А4, А5 и А6 осуществлялось на основании сведений из Реестра МВ,
2 - если данный запрос отсутствует в Реестре МВ.",
1,Копия документа об оплате государственной пошлины за предоставление лицензии,Сведения о госпошлине,,Министерство экономического развития и торговли Камчатского края,"Зам. Министра - начальник отдела торговли, лицензирования и контроля алкогольной продукции",Федеральное Казначейство ,,1,
2,Копия документа о государственной регистрации организации юридического лица,"Сведения, подтверждающие факт внесения сведений о соискатели лицензии в единый государственный реестр юридических лиц",,Министерство экономического развития и торговли Камчатского края,"Зам. Министра - начальник отдела торговли, лицензирования и контроля алкогольной продукции",ФНС России,,1,
3,Копия документа о постановке организации на учет в налоговый орган,Сведения о постановке на учет в налоговом органе Российской Федерации,,Министерство экономического развития и торговли Камчатского края,"Зам. Министра - начальник отдела торговли, лицензирования и контроля алкогольной продукции",ФНС России,,1,
4,Свидетельство о государственной регистрации права собственности,Сведения из ЕГРП о правах отдельного лица,,Министерство экономического развития и торговли Камчатского края,"Зам. Министра - начальник отдела торговли, лицензирования и контроля алкогольной продукции",Росреестр,,1,
5,Договор о закреплении имущества на праве хозяйственного ведения или оперативного управления;   ,Выписка из Единого государственного реестра прав на недвижимое имущество и сделок с ним о переходе прав на объект недвижимого имущества,,Министерство экономического развития и торговли Камчатского края,"Зам. Министра - начальник отдела торговли, лицензирования и контроля алкогольной продукции",Росреестр,,1,
6,Договор аренды на срок один год и более;  ,Выписка из Единого государственного реестра прав на недвижимое имущество и сделок с ним о переходе прав на объект недвижимого имущества  ,,Министерство экономического развития и торговли Камчатского края,"Зам. Министра - начальник отдела торговли, лицензирования и контроля алкогольной продукции",Росреестр,,1,
7,Заключения специально уполномоченных государственных органов о соответствии стационарных торговых объектов и складских помещений заявителя санитарно-эпидемиологическим требованиям,"Запрос о Сведениях из Санитарно-эпидемиологического заключения о соответствии зданий, строений, сооружений, помещений установленным требованиям",,Министерство экономического развития и торговли Камчатского края,"Зам. Министра - начальник отдела торговли, лицензирования и контроля алкогольной продукции",Роспотребнадзор,,1,
8,"Документ, содержащий сведения о наличии (отсутствии) задолженности по уплате налогов, сборов, пеней и штрафов за нарушение законодательства Российской Федерации о налогах и сборах",Сведения о наличии (отсутствии) задолженности, ,Министерство экономического развития и торговли Камчатского края,"Зам. Министра - начальник отдела торговли, лицензирования и контроля алкогольной продукции",ФНС России,,1,
