,,,,,,,,,,,,,,,,,,,,
"Сведения о выданных (продленных), переоформленных, приостановленных и аннулированных в судебном порядке лицензиях на розничную продажу алкогольной продукции,",,,,,,,,,,,,,,,,,,,,
"а также о лицензиях, действие которых прекращено по истечению срока действия таких лицензий, и в случае ликвидации организации или в случае принятия лицензирующим ",,,,,,,,,,,,,,,,,,,,
"органом решения о досрочном прекращении действия такой лицензии на основании заявления организации, по состоянию на 08.10.2012 г.",,,,,,,,,,,,,,,,,,,,
,,,,,,,,,,,,,,,,,,,,
№ п/п,Лицензиат,,,ИНН,КПП,Адрес юридический,Адрес осуществления деятельности,Код субъекта РФ,Регистрационный номер лицензии,Серия лицензии,Номер лицензии,"Дата выдачи (месяц, число, год)","Дата окончания действия (месяц, число, год)","Дата приостановления действия (месяц, число, год)","Дата возобновления действия (месяц, Число, год)","Дата прекращения действия (месяц, число, Год)","Дата анулирования (месяц, число, год)",Контактный телефон,Руководитель,"Орган исполнительной власти, выдавший лицензию"
4,Баловневское сельпо,,,4803000943,480301001,"399830, Липецкая обл, Данковский р-н, Баловнево с, Зеленая ул, дом № 6",Согласно выданным лицензиям,48,60,Г,603199,01.21.2002,01.21.2005,,,,,(47465) 5-32-41; 5-31-46,Ряховский Владимир Петрович,Управление лицензирования администрации Липецкой области
127,Березовское сельпо,,,4803000968,480301001,"399811, Липецкая обл, Данковский р-н, Березовка с, Сельпо пер, дом № 1",Согласно выданным копиям,48,62,Г,603201,01.21.2002,01.21.2005,,,,,(47465) 4-11-10; 4-11-37,Шемякина Галина Сергеевна,Управление лицензирования администрации Липецкой области
183,Воловское райпо,,,4801000070,,с.Волово ул.Советская д.82,Согласно выданным копиям лицензии,48,100,Г,603274,02.05.2002,02.05.2005,,,,,2-12-75,Сухарева Наталья Ивановна,Управление лицензирования администрации Липецкой области
246,Данковский районный союз потребительских обществ,,,4803001009,,"399850, Липецкая обл, Данковский р-н, Данков г, Л.Толстого ул, дом № 42",Согласно выданным лицензиям,48,59,Г,603198,01.21.2002,01.21.2005,,,,,(47465) 6-28-68,Сучкова Валентина Николаевна,Управление лицензирования администрации Липецкой области
265,Данковское сельпо,,,4803000990,480301001,"399850, Липецкая обл, Данковский р-н, Данков г, Горького ул, дом № 2/1",Согласно выданным копиям,48,61,Г,603200,01.21.2002,01.21.2005,,,,,(47465) 6-66-90,Баранцева Татьяна Ивановна,Управление лицензирования администрации Липецкой области
362,Добринское райпо,,,4804001876,480401001,"399431, Липецкая обл, Добринский р-н, Добринка п, Октябрьская ул, дом № 19",Согласно выданным копиям лицензии,48,96,Г,603257,02.04.2002,02.04.2005,,,,,(47462) 2-16-49,Будаев Юрий Васильевич,Управление лицензирования администрации Липецкой области
896,Елецкое РАЙПО,,,4807000165,482101001,"399774, Липецкая обл, Елецкий р-н, Елец г, Федеративная ул, дом № 9","Липецкая обл, Елецкий р-н",48,80,Г,603237,01.29.2002,01.29.2005,,,,,(47467) 2-66-53,Уточкин Николай Иванович,Управление лицензирования администрации Липецкой области
1100,"ЗАО ""Агрофирма им.15 лет Октября""",,,4811004620,481101001,"399626, Липецкая обл, Лебедянский р-н, Троекурово с",Лебедянский р-н с.Троекурово,48,474,Д,235696,09.01.2004,09.01.2007,,,,,9-71-25,Еремеев Николай Дмитриевич,Департамент потребительского рынка адм. Липецкой области
1103,"ЗАО ""Витамин""",,,4821010454,,"399774, Липецкая обл, Елецкий р-н, Елец г, Юбилейная ул, дом № 19-а","399774, Липецкая обл, Елецкий р-н, Елец г, Юбилейная ул, дом № 19-а",48,709,Д,235114,12.23.2003,12.23.2006,,,,,(47467) 4-03-50,Кузьмина Галина Александровна,Департамент потребительского рынка адм. Липецкой области
1106,"ЗАО ""Глория""",,,4821009699,,"399774, Липецкая обл, Елецкий р-н, Елец г, Мира ул, дом № 125",г.Елец ул.Мира д.125,48,656,Д,235916,12.29.2004,12.29.2007,,,,,(47467) 2-23-89,Целыковская Татьяна Петровна,Департамент потребительского рынка адм. Липецкой области
1108,"ЗАО ""Грязинский сахарный завод""",,,4802000958,,"399059, Липецкая обл, Грязинский р-н, Грязи г, Крылова ул, дом № 6",По месту нахожд.обособ.подразд.,48,322,Г,603572,04.04.2002,04.04.2005,,,,,(47461) 2-04-40,Трубкин Анатолий Степанович,Управление лицензирования администрации Липецкой области
1122,"ЗАО ""Дольчевита""",,,4824015355,482401001,"398024, Липецкая обл, Липецк г, Папина ул, дом № 6",г.Липецк ул.Папина д.6,48,481,Г,603788,06.07.2002,06.07.2005,,,,,(4742) 40-66-77,Кондратьев Владимир Геннадьевич,Управление лицензирования администрации Липецкой области
1137,"ЗАО ""Исток""",,,4805003080,,"399151, Липецкая обл, Добровский р-н, Трубетчино с, Почтовая ул","399155, Липецкая обл, Добровский р-н, Порой с, Сельская ул",48,25,Г,599102,09.11.2002,09.11.2005,,,,,(47463) 4-05-77,Тасенко Сергей Юрьевич,Департамент потребительского рынка адм. Липецкой области
1146,"ЗАО ""Каскад-Наука""",,,4804003810,,р.п.Добринска ул.Эртеля д.38,р.п.Добринска ул.Октябрьская д.32,48,455,Г,603753,05.29.2002,05.29.2005,,,,,2-32-51,Джегерук Виктор Михайлович,Управление лицензирования администрации Липецкой области
1161,"ЗАО ""ЛАЛ""",,,4826021690,,"398600, Липецкая обл, Липецк г, Доватора ул, дом № 2-а","398046, Липецкая обл, Липецк г, Стаханова ул, дом № 48-а",48,152,Г,599244,11.27.2002,11.27.2005,,,,,(4742) 47-75-87,Сметанин Леонид Антипович,Департамент потребительского рынка адм. Липецкой области
1168,"ЗАО ""Липецкнефтепродукт""",,,4822000201,482201001,"398016, Липецкая обл, Липецк г, Гагарина ул, дом № 102",Лип.р-н с.Боринское а/м Дон подъезд к г.Липецку км 36+300,48,90,Г,599192,10.29.2002,10.29.2005,,,,,(4742) 36-87-89,Бровкин Александр Иванович,Департамент потребительского рынка адм. Липецкой области
1802,"ЗАО ""Международная ассоциация делового сотрудничества С.А.""Липецкий""",,,4824005710,,"398059, Липецкая обл, Липецк г, К.Маркса ул, дом № 30","398059, Липецкая обл, Липецк г, Фрунзе ул, дом № 30",48,670,Д,476667,12.09.2005,12.09.2008,,,,,(4742) 77-26-26,Казаров Азат Сергеевич,Департамент потребительского рынка адм. Липецкой области
1803,"ЗАО ""МРИЯ""",,,4821011497,,г.Елец ул.Спутников д.15,г.Елец ул.Спутников д.15,48,713,Д,235958,12.29.2004,12.29.2007,03.30.2007,04.07.2007,,,2-34-15,дир.Лизунова Марина Анатольевна,Департамент потребительского рынка адм. Липецкой области
1804,"ЗАО ""Мясокомбинат Данковский""",,,4803004391,,"399850, Липецкая обл, Данковский р-н, Данков г, Зайцева ул, дом № 10","399850, Липецкая обл, Данковский р-н, Данков г, Зайцева ул, дом № 10, корпус 2",48,744,Д,235151,12.30.2003,12.30.2006,,,,,(47465) 6-24-34,Зубкова Надежда Егоровна,Департамент потребительского рынка адм. Липецкой области
1827,"ЗАО ""Огонек""",,,4821011257,,"399774, Липецкая обл, Елецкий р-н, Елец г, Коммунаров ул, дом № 34","399774, Липецкая обл, Елецкий р-н, Елец г, Коммунаров ул, дом № 34",48,729,Д,235133,12.30.2003,12.30.2006,,,,,(47467) 2-22-80,Дорохина Любовь Никитична,Департамент потребительского рынка адм. Липецкой области
1829,"ЗАО ""Ольшанский карьер""",,,4821014339,,"399774, Липецкая обл, Елецкий р-н, Елец г, Томский пер, дом № 17","399774, Липецкая обл, Елецкий р-н, Елец г, 8 Марта ул",48,673,Д,476665,12.09.2005,12.09.2008,,,,,(47467) 2-02-22,Поваляев Вячеслав Борисович,Департамент потребительского рынка адм. Липецкой области
1831,"ЗАО ""Промстройкомплект""",,,4826024605,,"398902, Липецкая обл, Липецк г, Юношеская ул, дом № 61",г.Липецк ул.Московская д.49/1,48,111,Г,599196,11.01.2002,11.01.2005,,,,,(4742) 33-22-06,Горин Сергей Григорьевич,Департамент потребительского рынка адм. Липецкой области
1833,"ЗАО ""Ремстройконтакт""",,,4826021724,,"398059, Липецкая обл, Липецк г, Советская ул, дом № 4",г.Липецк ул.Гагарина д.6,48,52,Г,603181,01.21.2002,01.21.2003,,,,,(4742) 24-76-09,Шарнин Александр Иванович,Управление лицензирования администрации Липецкой области
1838,"ЗАО ""Сюрприз""",,,4821011480,,"399774, Липецкая обл, Елецкий р-н, Елец г, Пушкина ул, дом № 22","399774, Липецкая обл, Елецкий р-н, Елец г, Пушкина ул, дом № 22",48,10,Д,235175,01.13.2004,01.13.2007,,,,,(47467) 2-82-29,Лихачева Валентина Егоровна,Департамент потребительского рынка адм. Липецкой области
3393,"ЗАО ""ТД Слобода""",,,4826028085,,"398059, Липецкая обл, Липецк г, Советская ул, дом № 66",г.Липецк ул.40 лет Октября д.11,48,260,Г,603502,03.22.2002,03.22.2003,,,,,(4742) 48-28-31,Путилин Сергей Иванович,Управление лицензирования администрации Липецкой области
3820,"ЗАО ""Уголек""",,,4802006477,,"399059, Липецкая обл, Грязинский р-н, Грязи г, Семашко ул, дом № 1","399059, Липецкая обл, Грязинский р-н, Грязи г, Семашко ул, дом № 1",48,277,Г,599653,04.25.2003,04.25.2006,05.19.2003,05.28.2003,,,(47461) 2-46-96,Ульянов Игорь Николаевна,Департамент потребительского рынка адм. Липецкой области
3835,"ЗАО ""Центрторгсервис""",,,4824014834,,"398006, Липецкая обл, Липецк г, Суворова ул, дом № 14",г.Липецк ул.Суворова д.14,48,163,Г,603338,02.18.2002,02.18.2003,,,,,(4742) 43-06-98,Качанов Сергей Алексеевич,Управление лицензирования администрации Липецкой области
3840,"ЗАО ""Энергопромсервис""",,,4823008718,482301001,"398600, Липецкая обл, Липецк г, 9 Мая ул, дом № 69",г.Липецк ул.Фрунзе д.30,48,273,Г,603516,03.28.2002,03.28.2003,09.19.2002,09.27.2002,,,(4742) 77-63-32,Тигиняна Ольга Викторовна,Управление лицензирования администрации Липецкой области
3844,"ЗАО ""Юбилей""",,,4821009642,,"399774, Липецкая обл, Елецкий р-н, Елец г, Коммунаров ул, дом № 101","399774, Липецкая обл, Елецкий р-н, Елец г, Коммунаров ул, дом № 101",48,710,Д,235128,12.30.2003,12.30.2006,,,,,(47467) 2-36-46,Куреев Александр Борисович,Департамент потребительского рынка адм. Липецкой области
3848,"ЗАО СФ ""Тербунская""",,,4815002991,,с.Тербуны ул.Советская,с.Тербуны ул.Мира,48,484,Д,235708,09.06.2004,09.06.2007,07.09.2007,07.19.2007,,,2-19-51,ген.дир.Кощеев Николай Петрович,Департамент потребительского рынка адм. Липецкой области
3856,Исток ООО (г.Липецк),,,4825036365,,"398016, Липецкая обл, Липецк г, Терешковой ул, дом № 13 ""б""",с.Хлевное ул.Свободы д.77,48,227,Д,235423,05.05.2004,05.05.2007,,,,,35-73-87,Чеснокова Мария Владимировна,Департамент потребительского рынка адм. Липецкой области
3860,Краснинское районное потребительское общество,,,4810000655,481001001,"399670, Липецкая обл, Краснинский р-н, Красное с, 70 лет Октября ул",Согласно выданным копиям лицензии,48,91,Г,603248,02.01.2002,02.01.2005,,,,,(47469) 2-02-78,Бурзуев Захир Захид Оглы,Управление лицензирования администрации Липецкой области
3979,"КФХ ""Восход""",,,4806000821,,"399526, Липецкая обл, Долгоруковский р-н, Меньшой Колодезь с","399526, Липецкая обл, Долгоруковский р-н, Меньшой Колодезь с",48,727,Д,235124,12.23.2003,12.23.2006,,,,,(47468) 2-42-89,Пальчиков Виктор Борисович,Департамент потребительского рынка адм. Липецкой области
4269,Лев Толстовское районное потребительское общество,,,4812000234,481201001,"399870, Липецкая обл, Лев-Толстовский р-н, Лев Толстой п, Льва Толстого ул, дом № 80",Согласно выданным копиям,48,88,Г,603240,02.01.2002,02.01.2005,,,,,(47464) 2-27-85,Кузин Роман Николаевич,Управление лицензирования администрации Липецкой области
4531,"Липецкая областная общественная организация инвалидов войны и труда  ""Славяне""",,,4824017433,,"398059, Липецкая обл, Липецк г, 8 Марта ул, дом № 26/2",г.Липецк ул.8 марта д.26/2,48,399,Г,603672,04.26.2002,04.26.2003,,,,,(4742) 74-36-72,Степанов Михаил Михайлович,Управление лицензирования администрации Липецкой области
4558,Липецкий областной фонд помощи актерам театров ,,,4826019764,,"398059, Липецкая обл, Липецк г, Фрунзе ул, дом № 12",г.Липецк пл.Театральная д.1,48,361,Г,603622,04.12.2002,04.12.2005,,,,,(4742) 77-05-36,Бражник Валентина Сергеевна,Управление лицензирования администрации Липецкой области
4561,Липецкое районное потребительское общество,,,4813000340,481301001,"398510, Липецкая обл, Липецкий р-н, Боринское с, Советская ул, дом № 1",Согласно выданным копиям лицензии,48,97,Г,603260,02.01.2002,02.01.2005,,,,,(4742) 51-02-42,Соколова Раиса Алексеевна,Управление лицензирования администрации Липецкой области
4822,"МУ киноконцертный зал ""Октябрь""",,,4826022615,,"398059, Липецкая обл, Липецк г, К.Маркса ул, дом № 6","398059, Липецкая обл, Липецк г, К.Маркса ул, дом № 6",48,29,Г,603154,01.15.2002,01.15.2003,,,,,(4742) 77-88-48,Лаврентьев Юрий Юрьевич,Управление лицензирования администрации Липецкой области
4827,"МУП ""Гарант"" Липецкого района Липецкой области",,,4813002001,481301001,"398510, Липецкая обл, Липецкий р-н, Боринское с, Луначарского ул, дом № 13","398902, Липецкая обл, Липецк г, Ударников ул, дом № 20а",48,39,ПВ,0000158,03.02.2009,03.01.2010,,,,,(4742) 40-02-67,Смирная Любовь Николаевна,Управление потребительского рынка Липецкой области
4830,"МУП ""Комбинат питания"" г.Ельца",,,4821011680,,"399774, Липецкая обл, Елецкий р-н, Елец г, Радиотехническая ул, дом № 1 ""б""","399774, Липецкая обл, Елецкий р-н, Елец г, Радиотехническая ул, дом № 1-б",48,473,Г,599857,07.18.2003,07.18.2006,,,,,(47467) 2-40-46,Шеренговская Надежда Алексеевна,Департамент потребительского рынка адм. Липецкой области
4835,"МУП ""магазин ""Наш огород""",,,4826000097,,"398000, Липецкая обл, Липецк г, Московская ул, дом № 5",г.Липецк ул.Московская д.5,48,591,Г,603943,07.19.2002,07.19.2003,,,,,(4742) 33-03-27,Филонова Галина Никоваевна,Управление лицензирования администрации Липецкой области
4840,"МУП ""Торговля и бытовые услуги""",,,4811007501,,"399610, Липецкая обл, Лебедянский р-н, Лебедянь г, Советская ул, дом № 91","399610, Липецкая обл, Лебедянский р-н, Лебедянь г, Советская ул, дом № 91",48,121,Д,476868,04.26.2006,04.26.2011,,,,,(47466) 5-24-94,Муковозов Олег Викторович,Департамент потребительского рынка адм. Липецкой области
4841,"МУП магазин ""Дары Осени""",,,4824000172,,"398046, Липецкая обл, Липецк г, 15-й мкр, дом № 8",г.Липецк ул.15 микрорайон д.8,48,177,Г,599278,12.11.2002,12.11.2003,,,,,(4742) 41-56-12,Семиколенова Раиса Ивановна,Департамент потребительского рынка адм. Липецкой области
4844,"МУП магазин ""Овощи""",,,4826020488,,"398043, Липецкая обл, Липецк г, Космонавтов ул, дом № 33/4","398043, Липецкая обл, Липецк г, Космонавтов ул, дом № 33/4",48,293,Г,599671,04.30.2003,04.30.2004,,,,,(4742) 35-45-22,Мещерякова Александра Павловна,Департамент потребительского рынка адм. Липецкой области
4845,"МУП магазин ""Осенний сад""",,,4826016996,,"398902, Липецкая обл, Липецк г, Детская ул, дом № 13",г.Липецк ул.Детская д.13,48,415,Г,603700,05.08.2002,05.08.2003,,,,,(4742) 40-03-16,Самохина Антонина Григорьевна,Управление лицензирования администрации Липецкой области
4847,"МУП магазин ""Ягодка""",,,4826006892,,"398059, Липецкая обл, Липецк г, 8 Марта ул, дом № 20",г.Липецк ул.8 Марта д.20,48,193,Г,599290,12.17.2002,12.17.2003,,,,,(4742) 77-65-34,Буева Галина Михайловна,Департамент потребительского рынка адм. Липецкой области
4852,"МУП общественного питания ""Котлетное"" г.Ельца",,,4821003457,,"399774, Липецкая обл, Елецкий р-н, Елец г, Советская ул, дом № 48","399774, Липецкая обл, Елецкий р-н, Елец г, Советская ул, дом № 48",48,233,Г,599332,12.25.2002,12.25.2003,,,,,(47467) 2-30-71,Дорошенко Зоя Семеновна,Департамент потребительского рынка адм. Липецкой области
4854,Новозадонское ПО,,,4808004589,480801001,"399201, Липецкая обл, Задонский р-н, Задонск г, Советская ул, дом № 27",Согласно выданным копиям,48,63,Г,603202,01.23.2002,01.23.2005,,,,,(47471) 2-18-60; 2-15-85,Путилин Сергей Евгеньевич,Управление лицензирования администрации Липецкой области
5424,"ОАО ""Агропромышленное объединение ""Аврора""",,,4825003761,,"398600, Липецкая обл, Липецк г, Поперечный проезд, дом № 3",г.Липецк ул.Московская д.61Д,48,121,Г,599208,11.04.2002,11.04.2003,,,,,(4742) 34-60-20,Уваркин Сергей Николаевич,Департамент потребительского рынка адм. Липецкой области
5428,"ОАО ""Грязинский культиваторный завод""",,,4802002850,,"399059, Липецкая обл, Грязинский р-н, Грязи г, Гагарина ул, дом № 1а",г.Грязи ул.Гагарина д.1-а,48,425,Г,603711,05.16.2002,05.16.2005,,,,,(47461) 2-07-75,Анисимов Николай Васильевич,Управление лицензирования администрации Липецкой области
5529,"ОАО ""Интурист - Елец""",,,4821020773,482101001,"399774, Липецкая обл, Елецкий р-н, Елец г, Коммунаров ул, дом № 14","399774, Липецкая обл, Елецкий р-н, Елец г, Коммунаров ул, дом № 14",48,272,ПВ,0000846,10.06.2011,10.05.2012,,,,,(47467) 2-23-10,Краснов Сергей Алексеевич,Управление потребительского рынка и ценовой политики Липецкой области
5531,"ОАО ""Комплекс-Советский""",,,4826018672,482201001,"398050, Липецкая обл, Липецк г, Ворошилова ул, дом № 5",г.Липецк ул.Ворошилова д.5,48,387,Г,603658,04.26.2002,04.26.2005,,,,,(4742) 77-82-21,Позднякова Валентина Михайловна,Управление лицензирования администрации Липецкой области
