,,,,,,,,,,,,,,,,,,,,
8070,"ООО ""КомВит""",,,4826069839,482601001,"398000, Липецкая обл, Липецк г, Политехническая ул, дом № 3, нежилое помещение № 2","398000, Липецкая обл, Липецк г, Политехническая ул, дом № 3, нежилое помещение № 2",48,17,ПВ,0000395,01.26.2010,01.25.2015,,,,,(4742) 54-06-02,Орлова Наталья Евгеньевна,Управление потребительского рынка Липецкой области
8071,"ООО ""Комета-ТВ""",,,4824025307,,"398046, Липецкая обл, Липецк г, Стаханова ул, дом № 19, кв.62",г.Липецк ул.Космонавтов д.82/1,48,606,Г,603962,07.25.2002,07.25.2003,,,,,(4742) 33-90-99,Мартынова Вера Александровна,Управление лицензирования администрации Липецкой области
8076,"ООО ""Комлайн""",,,4826028423,,"398020, Липецкая обл, Липецк г, Студеновская ул, дом № 22",г.Липецк ул.Студеновская д.22,48,400,Г,603674,04.30.2002,04.30.2003,,,,,(4742) 27-25-56,Боровков Владимир Александрович,Управление лицензирования администрации Липецкой области
8081,"ООО ""Компания""",,,4824051071,482401001,"398006, Липецкая обл, Липецк г, Ленинградская ул, дом № 6","398006, Липецкая обл, Липецк г, Ленинградская ул, дом № 6",48,70,ПВ,0000640,04.27.2011,04.26.2012,04.11.2012,,,,(4742) 78-12-25,Потанин Олег Олегович,Управление потребительского рынка и ценовой политики Липецкой области
8086,"ООО ""Кондитер-Л""",,,4826039827,,"398059, Липецкая обл, Липецк г, Советская ул, дом № 66","398059, Липецкая обл, Липецк г, Советская ул, дом № 71",48,629,Д,235020,10.29.2003,10.29.2006,05.22.2006,,,,(4742) 22-12-81,Сероштанов Игорь Алексеевич,Департамент потребительского рынка адм. Липецкой области
8087,"ООО ""Конкурент""",,,4824049259,482401001,"398046, Липецкая обл, Липецк г, П.Смородина ул, дом № 12, корпус в","398046, Липецкая обл, Липецк г, П.Смородина ул, дом № 12, корпус в",48,13,ПВ,0000394,01.26.2010,01.25.2015,,,,,89202404011,Меркулов Игоррь Николаевич,Управление потребительского рынка Липецкой области
8089,"ООО ""Константа""",,,4826056565,482601001,"398016, Липецкая обл, Липецк г, Терешковой ул, дом № 27 ""а""","398016, Липецкая обл, Липецк г, Терешковой ул, дом № 27 ""а""",48,240,Д,475671,11.09.2007,11.09.2012,08.16.2010,09.10.2010,,,(4742) 35-59-24,Мартиросян Каро Ашотович,Управление потребительского рынка Липецкой области
8151,"ООО ""Копилка""",,,4823027069,482301001,"398005, Липецкая обл, Липецк г, Осенний проезд, дом № 1 Г","399059, Липецкая обл, Грязинский р-н, Грязи г, Семашко ул, дом № 1",48,723,Д,476716,12.28.2005,12.28.2008,,,,,(4742) 28-72-47,Андреев Дмитрий Миххайлович,Департамент потребительского рынка адм. Липецкой области
8161,"ООО ""Коралл""",,,4811005656,,"399610, Липецкая обл, Лебедянский р-н, Лебедянь г, Советская ул, дом № 45",г.Лебедянь ул.Советская д.45,48,439,Г,603731,05.22.2002,05.22.2005,11.20.2003,12.02.2003,,,(47466) 5-21-01,Кожевникова Галина Александровна,Управление лицензирования администрации Липецкой области
8165,"ООО ""Корона"" ",,,4824029206,482401001,"398059, Липецкая обл, Липецк г, 50 лет НЛМК ул, дом № 5 ""а""","398059, Липецкая обл, Липецк г, 50 лет НЛМК ул, дом № 5-а",48,633,Д,235028,10.31.2003,10.31.2006,,,,,(4742) 74-54-58,Лепекина Валентина Васильевна,Департамент потребительского рынка адм. Липецкой области
8178,"ООО ""Кофейный Дом""",,,4826075511,482601001,"398050, Липецкая обл, Липецк г, Плеханова пл, дом № 1","398050, Липецкая обл, Липецк г, Плеханова пл, дом № 1",48,46,ПВ,0000618,04.05.2011,04.04.2012,,,,,(4742) 47-00-57,Гаркушина Ирина Юрьевна,Управление потребительского рынка и ценовой политики Липецкой области
8190,"ООО ""Кофемикс""",,,4824053424,482401001,"398024, Липецкая обл, Липецк г, Папина ул, дом № 6","398024, Липецкая обл, Липецк г, Папина ул, дом № 6",48,197,ПВ,0000772,07.20.2011,07.19.2012,,,,,(4742) 40-66-77,Бартенева Вера Петровна,Управление потребительского рынка и ценовой политики Липецкой области
8191,"ООО ""Красный Горняк""",,,4802003645,,Гряз.р-н с.Б.Сомовец ул.Октябрьская д.3,г.Грязи ул.Гризодубовой д.31-а,48,145,Г,599235,11.21.2002,11.21.2003,,,,,3-31-52,Хачиперадзе Джимал Самсонович,Департамент потребительского рынка адм. Липецкой области
8192,"ООО ""Кратос R""",,,4807004459,,"399755, Липецкая обл, Елецкий р-н, Воронец с",г.Елец ул.Коммунаров 75,48,665,Г,599053,08.23.2002,08.23.2003,,,,,(47467) 5-31-51,Курносова Александра Ивановна,Управление лицензирования администрации Липецкой области
8205,"ООО ""Кредо""",,,4821009427,,"399774, Липецкая обл, Елецкий р-н, Елец г, Коммунаров ул, дом № 135-а",г.Елец ул.Коммунаров д.135-а,48,623,Д,235863,11.30.2004,11.30.2007,,,,,(47467) 2-36-94,Кленикова Светлана Александровна,Департамент потребительского рынка адм. Липецкой области
8209,"ООО ""Кристалл""",,,4807008862,,"399510, Липецкая обл, Долгоруковский р-н, Долгоруково с, 50 лет Советской Власти ул, дом № 28","399510, Липецкая обл, Долгоруковский р-н, Долгоруково с, 50 лет Советской Власти ул, дом № 28",48,291,Д,475067,07.04.2006,07.04.2011,,,,,(47468) 2-17-81,Карташова Людмила Ивановна,Департамент потребительского рынка адм. Липецкой области
8210,"ООО ""Кристина""",,,4815002920,,"399540, Липецкая обл, Тербунский р-н, Тербуны с, Донская ул, дом № 32",с.Тербуны ул.Ленина д.119,48,239,Г,603463,03.15.2002,03.15.2003,,,,,(47474) 2-12-99,Четвериков Сергей Петрович,Управление лицензирования администрации Липецкой области
8212,"ООО ""Кристина"" ",,,4821017756,,"399774, Липецкая обл, Елецкий р-н, Елец г, Пушкина ул","399774, Липецкая обл, Елецкий р-н, Елец г, Пушкина ул",48,90,Д,476837,04.13.2006,04.13.2011,,,,,(47467) 5-32-01,Полосин Юрий Васильевич,Департамент потребительского рынка адм. Липецкой области
8213,"ООО ""Кристина"" (Липецкий район)",,,4813013613,481301001,"398533, Липецкая обл, Липецкий р-н, Сырское с, 8 Марта ул, дом № 2-в","Липецкая обл, Липецкий р-н, Пады с, Усманская ул, дом № 43 а",48,212,ПВ,0000788,07.29.2011,07.28.2016,,,,,,Зыкова Ирина Михайловна,Управление потребительского рынка и ценовой политики Липецкой области
8217,"ООО ""КРОКУС""",,,4802007495,480201001,"399059, Липецкая обл, Грязинский р-н, Грязи г, Правды ул, дом № 49 ""а""","399059, Липецкая обл, Грязинский р-н, Грязи г, Правды ул, дом № 49а",48,723,Д,235123,12.23.2003,12.23.2006,,,,,(47461) 2-05-69,Никишева Лилия Николаевна,Департамент потребительского рынка адм. Липецкой области
8241,"ООО ""КТ""",,,4825045585,482501001,"398007, Липецкая обл, Липецк г, Ушинского ул, дом № 8","398007, Липецкая обл, Липецк г, Ушинского ул, дом № 8",48,387,Д,475146,07.18.2006,07.18.2011,,,,,(4742) 48-17-85,Климова Людмила Викторовна,Департамент потребительского рынка адм. Липецкой области
8243,"ООО ""Кулинария""",,,4823023561,,"398005, Липецкая обл, Липецк г, Мира пр-кт, дом № 17","398005, Липецкая обл, Липецк г, Мира пр-кт, дом № 17",48,13,Д,235177,01.13.2004,01.13.2007,05.22.2006,,,,(4742) 43-00-89,Карпова Зинаида Григорьевна,Департамент потребительского рынка адм. Липецкой области
8244,"ООО ""Кулинария""",,,4813010010,480501001,"399140, Липецкая обл, Добровский р-н, Доброе с, Интернациональная ул","399140, Липецкая обл, Добровский р-н, Доброе с, Интернациональная ул",48,140,Д,475886,05.27.2008,05.27.2013,,,,,(47463) 2-20-76,Сасонская Надежда Павловна,Управление потребительского рынка Липецкой области
8246,"ООО ""КУЛЬТУРНО-РАЗВЛЕКАТЕЛЬНЫЙ ЦЕНТР ""Кристалл""",,,4824017377,,"398024, Липецкая обл, Липецк г, Победы пр-кт, дом № 93-А",г.Липецк пр.Победы д.93-а,48,538,Г,603860,06.28.2002,06.28.2003,,,,,(4742) 41-52-37,Селезнев Сергей Петрович,Управление лицензирования администрации Липецкой области
8249,"ООО ""Кунов""",,,4823028224,482301001,"398029, Липецкая обл, Липецк г, Ярославская ул, дом № 13","398029, Липецкая обл, Липецк г, Ярославская ул, дом № 13",48,316,Д,475090,07.10.2006,07.10.2011,,,,,(4742) 70-96-28,Кунов Валерий Иванович,Департамент потребительского рынка адм. Липецкой области
8250,"ООО ""Купец""",,,4811010335,481201001,"399870, Липецкая обл, Лев-Толстовский р-н, Лев Толстой п, Коммунистическая ул, дом № 9а","399870, Липецкая обл, Лев-Толстовский р-н, Лев Толстой п, Коммунистическая ул, дом № 9а",48,241,ПВ,0000003,09.17.2008,09.16.2013,,,,,89103581635,,Управление потребительского рынка Липецкой области
8251,"ООО ""Курс""",,,4821018929,482101001,"399774, Липецкая обл, Елецкий р-н, Елец г, Радиотехническая ул, дом № 34, кв.62","399774, Липецкая обл, Елецкий р-н, Елец г, Костенко ул, дом № 49",48,85,Д,475511,04.20.2007,04.20.2012,,,,,(47467) 5-12-74,Крюков Владимир Николаевич,Управление потребительского рынка Липецкой области
8252,"ООО ""Курс""",,,4826042315,480801001,"Липецкая обл, Задонский р-н, урочище ""Скит""","Липецкая обл, Задонский р-н, урочище ""Скит""",48,225,Д,475991,09.01.2008,08.31.2013,,,,,(4742) 74-58-14,Маркин Сергей Сергеевич,Управление потребительского рынка Липецкой области
8254,"ООО ""Кэр - Сервис""",,,4825016369,482501001,"398600, Липецкая обл, Липецк г, Универсальный проезд, дом № 2","398016, Липецкая обл, Липецк г, Терешковой ул, дом № 13, корпус Б",48,165,ПВ,0000542,11.13.2010,11.12.2015,,,,,(4742) 32-58-28,Думанова Ирина Владимировна,Управление потребительского рынка и ценовой политики Липецкой области
8255,"ООО ""Л-ТОЙС""",,,4826020960,482601001,"398042, Липецкая обл, Липецк г, Я.Фабрициуса ул, дом № 21, кв.85","398024, Липецкая обл, Липецк г, Победы пр, дом № 92",48,176,ПВ,0000314,10.13.2009,10.12.2014,09.27.2010,10.07.2010,,,(4742) 33-30-71,Ларин Константин Эдуардович,Управление потребительского рынка Липецкой области
8256,"ООО ""ЛАГУНА Ресторан""",,,4825060713,482501001,"398007, Липецкая обл, Липецк г, Ковалева ул, дом № 115/8","398005, Липецкая обл, Липецк г, Мира пл, дом № 1д",48,122,ПВ,0000248,07.27.2009,07.26.2014,,,,,(4742) 51-70-70,Пацека Вадим Генрихович,Управление потребительского рынка Липецкой области
8257,"ООО ""Лагуна-Л""",,,4823028143,482301001,"398000, Липецкая обл, Липецк г, Моршанская ул, дом № 1б","398000, Липецкая обл, Липецк г, Моршанская ул, дом № 1 б",48,243,Д,475018,06.30.2006,06.30.2011,,,,,(4742) 39-11-12; 70-92-64,Чеканов Андрей Николаевич,Департамент потребительского рынка адм. Липецкой области
8260,"ООО ""ЛАГУНА""",,,4821009459,,"399774, Липецкая обл, Елецкий р-н, Елец г, Героев ул, дом № 21, кв.24","399774, Липецкая обл, Елецкий р-н, Елец г, Черокманова ул, дом № 15-а",48,531,Г,599919,08.29.2003,08.29.2006,,,,,(47467) 5-17-19,Быкова Марина Игоревна,Департамент потребительского рынка адм. Липецкой области
8262,"ООО ""ЛАГУНА"" ",,,4811006145,481101001,"399610, Липецкая обл, Лебедянский р-н, Лебедянь г, Трудовая ул, дом № 1, кв.17","399610, Липецкая обл, Лебедянский р-н, Лебедянь г, Строителей ул, дом № 22 ""а""",48,517,Д,475272,09.26.2006,09.26.2011,,,,,89103514238; 89102590633,Коновалов Олег Юрьевич,Департамент потребительского рынка Липецкой области
8264,"ООО ""Лада""",,,4807008372,480601001,"399510, Липецкая обл, Долгоруковский р-н, Долгоруково с, Дудченко ул, дом № 5","399501, Липецкая обл, Долгоруковский р-н, Красотыновка д",48,191,Д,475006,06.29.2006,06.29.2011,,,,,(47468) 21629; 89103505954,Давыдова Наталья Семеновна,Департамент потребительского рынка адм. Липецкой области
8278,"ООО ""Лакомка""",,,4811006201,,"399610, Липецкая обл, Лебедянский р-н, Лебедянь г, Ворошилова ул, дом № 22","399610, Липецкая обл, Лебедянский р-н, Лебедянь г, Мира ул, дом № 10",48,180,Г,599553,03.27.2003,03.27.2006,,,,,(47466) 5-21-15,Пономарева Екатерина Евгеньевна,Департамент потребительского рынка адм. Липецкой области
8284,"ООО ""Ланнетта""",,,4824052389,482401001,"398000, Липецкая обл, Липецк г, П.И.Смородина ул, дом № 1а","398046, Липецкая обл, Липецк г, П.И.Смородина ул, владение 1а",48,161,ПВ,0000732,07.01.2011,06.30.2012,,,,,89056847854,Севостьянов Алексей Васильевич,Управление потребительского рынка и ценовой политики Липецкой области
8285,"ООО ""Ларец""",,,4802010762,480401001,"399417, Липецкая обл, Добринский р-н, Хворостянка с","399417, Липецкая обл, Добринский р-н, Хворостянка с",48,264,Д,475687,12.04.2007,12.04.2012,,,,,(47462) 5-74-65,Кечко Валерий Анатольевич,Управление потребительского рынка Липецкой области
8286,"ООО ""ЛАС ПИВАС""",,,4823032196,482301001,"398005, Липецкая обл, Липецк г, Металлургов пл, дом № 2","398005, Липецкая обл, Липецк г, Металлургов пл, дом № 2",48,7,Д,475777,02.06.2008,02.06.2013,05.19.2011,07.08.2011,,,(4742) 44-34-38,Демидов Олег Михайлович,Управление потребительского рынка Липецкой области
8289,"ООО ""Ласточка""",,,4816022969,481601001,"399373, Липецкая обл, Усманский р-н, Усмань г, Ленина ул, дом № 182а","399346, Липецкая обл, Усманский р-н, Завальное с, Ленина ул, дом № 28-а",48,213,ПВ,0001171,08.03.2012,08.02.2015,,,,,89205136816,Давыдов Александр Михайлович,Управление потребительского рынка и ценовой политики Липецкой области
8290,"ООО ""ЛДС""",,,4825064891,482501001,"398002, Липецкая обл, Липецк г, Тельмана ул, дом № 116а","398002, Липецкая обл, Липецк г, Тельмана ул, дом № 116а",48,220,ПВ,0000355,12.09.2009,12.08.2014,,,,,89205063040,Блинова Светлана Валерьевна,Управление потребительского рынка Липецкой области
8291,"ООО ""Левобережный""",,,4823027365,482301001,"398005, Липецкая обл, Липецк г, Парковая ул, дом № 10","398005, Липецкая обл, Липецк г, Парковая ул, дом № 10",48,55,Д,476822,04.04.2006,04.04.2011,,,,,(4742) 43-11-35,Симонова Татьяна Николаевна,Департамент потребительского рынка адм. Липецкой области
8295,"ООО ""Ленар""",,,4825022926,,"398050, Липецкая обл, Липецк г, Ленина ул, дом № 11","398059, Липецкая обл, Липецк г, К.Маркса ул, дом № 30",48,527,Г,599936,09.04.2003,09.04.2004,,,,,(4742) 27-74-46,Царевская Любовь Алексеевна,Департамент потребительского рынка адм. Липецкой области
8297,"ООО ""Леонид""",,,4826032892,,"398000, Липецкая обл, Липецк г, Московская ул, дом № 135, кв.151",г.Липецк ул.Студеновская д.184,48,102,Г,599187,10.25.2002,10.25.2003,,,,,(4742) 27-68-65,Спесивцев Алексей Александрович,Департамент потребительского рынка адм. Липецкой области
8299,"ООО ""Лето""",,,4825011755,,"398059, Липецкая обл, Липецк г, К.Маркса ул, дом № 29","398059, Липецкая обл, Липецк г, Скороходова ул, дом № 2",48,695,Д,235098,12.10.2003,12.10.2006,,,,,(4742) 22-70-26,Нефедова Татьяна Николаевна,Департамент потребительского рынка адм. Липецкой области
8300,"ООО ""ЛИВ""",,,4823021317,,"398005, Липецкая обл, Липецк г, Мира пр-кт, дом № 33","398005, Липецкая обл, Липецк г, Мира пр-кт, дом № 33",48,328,Г,599701,05.16.2003,05.16.2004,,,,,(4742) 43-56-89,Евлаков Руслан Николаевич,Департамент потребительского рынка адм. Липецкой области
8305,"ООО ""Лига 48""",,,4826067662,482601001,"398059, Липецкая обл, Липецк г, Скороходова ул, дом № 1а","398059, Липецкая обл, Липецк г, Скороходова ул, дом № 1а",48,113,ПВ,0000240,07.08.2009,07.07.2014,04.11.2012,,,,(4742) 37-77-12,Павленко Владимир Сергеевич,Управление потребительского рынка Липецкой области
8308,"ООО ""Лидер""",,,4802010201,480401001,"399420, Липецкая обл, Добринский р-н, Плавица ж/д_ст, Строителей ул, дом № 46","399420, Липецкая обл, Добринский р-н, Плавица ж/д_ст, Строителей ул, дом № 46",48,551,Д,475299,10.12.2006,10.12.2011,,,,,(47462) 3-80-79; 89038607589; 89508095799,Огаркин Игорь Геннадиевич,Департамент потребительского рынка Липецкой области
8311,"ООО ""Лидия""",,,4821014441,,"399774, Липецкая обл, Елецкий р-н, Елец г, Орджоникидзе ул, дом № 11","399774, Липецкая обл, Елецкий р-н, Елец г, Новолипецкая ул, дом № 3-б",48,461,Д,475212,08.14.2006,08.14.2011,,,,,(47467) 2-32-26,Алимова Лидия Борисовна,Департамент потребительского рынка Липецкой области
8313,"ООО ""Лидия""",,,4807011706,,"399710, Липецкая обл, Становлянский р-н, Становое с, Становлянская ул, дом № 46","399710, Липецкая обл, Становлянский р-н, Становое с, Становлянская ул, дом № 52",48,106,Д,475850,04.23.2008,04.23.2013,,,,,2-21-99,Петров Александр Павлович,Управление потребительского рынка Липецкой области
8314,"ООО ""Лика""",,,4826051285,,"398902, Липецкая обл, Липецк г, Детская ул, дом № 13а","398902, Липецкая обл, Липецк г, Детская ул, дом № 13а",48,323,Д,475048,06.30.2006,06.30.2011,,,,,(4742) 41-93-99,Галоян Хачатур Карапетович,Департамент потребительского рынка адм. Липецкой области
8317,"ООО ""ЛиКомп""",,,4823027862,482301001,"398005, Липецкая обл, Липецк г, Ферросплавная ул, дом № 42","398005, Липецкая обл, Липецк г, Ферросплавная ул, дом № 42",48,483,Д,475242,09.01.2006,09.01.2011,,,,,(4742) 39-67-21; 70-89-48,Войнов Андрей Васильевич,Департамент потребительского рынка Липецкой области
8372,"ООО ""Лилия""",,,4811009530,481101001,"399610, Липецкая обл, Лебедянский р-н, Лебедянь г, Дзержинского ул, дом № 4а","399610, Липецкая обл, Лебедянский р-н, Лебедянь г, Дзержинского ул, дом № 4а",48,641,Д,475392,12.22.2006,12.22.2011,,,,,(47466) 5-16-52; 89601545860,Козлова Ольга Николаевна,Департамент потребительского рынка Липецкой области
8373,"ООО ""ЛИМ""",,,4811009770,480301001,"399850, Липецкая обл, Данковский р-н, Данков г, Ленина ул, дом № 2/1","399850, Липецкая обл, Данковский р-н, Данков г, Ленина ул, дом № 2/1",48,114,Д,475539,06.01.2007,06.01.2012,,,,,(47465) 6-25-50,Бабкин Игорь Анатольевич,Управление потребительского рынка Липецкой области
